{
  "$schema": "https://json-schema.org/draft/2020-12/schema",
  "$id": "https://statistikassistenten.local/schemas/presentation-result.schema.json",
  "title": "Presentation Result",
  "type": "object",
  "additionalProperties": false,
  "required": ["title", "answer", "rows", "analysis", "method_notes", "sources"],
  "properties": {
    "title": {"type": "string", "minLength": 1},
    "answer": {"type": "string", "minLength": 1},
    "rows": {
      "type": "array",
      "items": {
        "type": "object",
        "additionalProperties": false,
        "required": ["dimensions", "value", "unit", "status", "origin"],
        "properties": {
          "dimensions": {"type": "object", "additionalProperties": {"type": "string"}},
          "value": {"type": ["number", "string", "null"]},
          "unit": {"type": "string"},
          "status": {"type": "string"},
          "origin": {"enum": ["source", "calculated"]}
        }
      }
    },
    "analysis": {"type": "array", "items": {"type": "string"}},
    "method_notes": {"type": "array", "items": {"type": "string"}},
    "sources": {
      "type": "array",
      "minItems": 1,
      "items": {
        "type": "object",
        "additionalProperties": false,
        "required": ["organization", "dataset"],
        "properties": {
          "organization": {"type": "string"},
          "dataset": {"type": "string"},
          "period": {"type": "string"},
          "geography": {"type": "string"},
          "measure": {"type": "string"},
          "url": {"type": "string"}
        }
      }
    }
  }
}
